{"name":"deploy_test_existing_dataset","network":"mainnet","version":"1.0.0","kind":"manifest","dependencies":{"raw_mainnet":{"owner":"test_owner","name":"base_dataset","version":"^0.0.1"}},"tables":{"test_table":{"input":{"sql":"SELECT * FROM base_dataset.blocks LIMIT 10"},"schema":{"arrow":{"fields":[]}},"network":"mainnet"}},"functions":{}}