{"name":"multi_version","network":"mainnet","version":"0.0.2","kind":"manifest","dependencies":{"eth_firehose":{"owner":"graphprotocol","name":"eth_firehose","version":"^0.1.0"}},"tables":{"blocks":{"input":{"sql":"SELECT block_num, gas_limit, hash, parent_hash FROM eth_firehose.blocks"},"schema":{"arrow":{"fields":[{"name":"_block_num","type":"UInt64","nullable":false},{"name":"block_num","type":"UInt64","nullable":false},{"name":"gas_limit","type":"UInt64","nullable":false},{"name":"hash","type":{"FixedSizeBinary":32},"nullable":false},{"name":"parent_hash","type":{"FixedSizeBinary":32},"nullable":false}]}},"network":"mainnet"}},"functions":{}}