{"name":"deploy_test_multi_version_deploy","network":"mainnet","version":"1.0.0","kind":"manifest","dependencies":{"raw_mainnet":{"owner":"test_owner","name":"base_dataset","version":"^0.0.1"}},"tables":{"test_table":{"input":{"sql":"SELECT block_num, miner, hash, parent_hash FROM eth_firehose.blocks"},"schema":{"arrow":{"fields":[{"name":"_block_num","type":"UInt64","nullable":false},{"name":"block_num","type":"UInt64","nullable":false},{"name":"miner","type":{"FixedSizeBinary":20},"nullable":false},{"name":"hash","type":{"FixedSizeBinary":32},"nullable":false},{"name":"parent_hash","type":{"FixedSizeBinary":32},"nullable":false}]}},"network":"mainnet"}},"functions":{}}