{"name":"intra_deps","network":"mainnet","version":"0.1.0","kind":"manifest","dependencies":{"eth_firehose":{"owner":"graphprotocol","name":"eth_firehose","version":"^0.1.0"}},"tables":{"aa_blocks_derived":{"input":{"sql":"SELECT block_num, gas_limit, gas_used, miner, hash, parent_hash FROM intra_deps.zz_blocks_base"},"schema":{"arrow":{"fields":[{"name":"_block_num","type":"UInt64","nullable":false},{"name":"block_num","type":"UInt64","nullable":false},{"name":"gas_limit","type":"UInt64","nullable":false},{"name":"gas_used","type":"UInt64","nullable":false},{"name":"miner","type":{"FixedSizeBinary":20},"nullable":false},{"name":"hash","type":{"FixedSizeBinary":32},"nullable":false},{"name":"parent_hash","type":{"FixedSizeBinary":32},"nullable":false}]}},"network":"mainnet"},"mm_blocks_derived":{"input":{"sql":"SELECT block_num, miner, hash, parent_hash FROM intra_deps.aa_blocks_derived"},"schema":{"arrow":{"fields":[{"name":"_block_num","type":"UInt64","nullable":false},{"name":"block_num","type":"UInt64","nullable":false},{"name":"miner","type":{"FixedSizeBinary":20},"nullable":false},{"name":"hash","type":{"FixedSizeBinary":32},"nullable":false},{"name":"parent_hash","type":{"FixedSizeBinary":32},"nullable":false}]}},"network":"mainnet"},"zz_blocks_base":{"input":{"sql":"SELECT block_num, gas_limit, gas_used, nonce, miner, hash, parent_hash FROM eth_firehose.blocks"},"schema":{"arrow":{"fields":[{"name":"_block_num","type":"UInt64","nullable":false},{"name":"block_num","type":"UInt64","nullable":false},{"name":"gas_limit","type":"UInt64","nullable":false},{"name":"gas_used","type":"UInt64","nullable":false},{"name":"nonce","type":"UInt64","nullable":false},{"name":"miner","type":{"FixedSizeBinary":20},"nullable":false},{"name":"hash","type":{"FixedSizeBinary":32},"nullable":false},{"name":"parent_hash","type":{"FixedSizeBinary":32},"nullable":false}]}},"network":"mainnet"}},"functions":{}}